{"cards":[],"contract":1,"events":[{"at":"2026-10-31T10:40:16+00:00","count":3,"kind":"scan","ref":"b4a70c4377f6dd28e8d4d1d7965206a1653055a0","title":"baseline"}],"missing":[],"progress":[{"at":"2026-10-31T10:40:16+00:00","closed":0,"commit":"b4a70c4377f6dd28e8d4d1d7965206a1653055a0","event":"baseline","percent":0.0,"total":3}],"revision":2,"scans":[{"added":null,"at":"2026-10-31T10:40:16+00:00","branch":"main","closed":0,"commit":"b4a70c4377f6dd28e8d4d1d7965206a1653055a0","event":"baseline","id":"b4a70c4377f6","open":{"critical":0,"high":0,"info":0,"low":3,"medium":0},"open_keys":[],"open_total":3,"resolved":null,"score":0.97,"total":3}],"schema_version":1,"src":{"cards":"ledger.json#cards[state done, or new]","progress":"ledger.json#history[].closed / total","scans":"ledger.json#history[event in baseline, recheck]; the last: this check","score":"model.score of this check; older checks: ledger.json#history[].scores (NS31.T1)"}}