{
 "schema_version": 1,
 "contract": 1,
 "revision": 2,
 "scans": [
  {
   "id": "a1b2c3d",
   "commit": "a1b2c3d",
   "branch": "main",
   "at": "2026-10-01T09:00:00+00:00",
   "score": 0.52,
   "open": {
    "critical": 1,
    "high": 9,
    "medium": 20,
    "low": 8,
    "info": 2
   },
   "added": null,
   "resolved": null,
   "open_keys": [],
   "event": "baseline",
   "open_total": 40,
   "closed": 0,
   "total": 40
  },
  {
   "id": "e4f5a6b",
   "commit": "e4f5a6b",
   "branch": "main",
   "at": "2026-10-08T09:00:00+00:00",
   "score": 0.6,
   "open": {
    "critical": 0,
    "high": 7,
    "medium": 18,
    "low": 8,
    "info": 2
   },
   "added": 2,
   "resolved": 6,
   "open_keys": [],
   "event": "recheck",
   "open_total": 35,
   "closed": 8,
   "total": 43
  }
 ],
 "events": [
  {
   "at": "2026-10-01T09:00:00+00:00",
   "kind": "scan",
   "title": "First check",
   "ref": "a1b2c3d"
  },
  {
   "at": "2026-10-03T14:20:00+00:00",
   "kind": "batch",
   "title": "Fix batch 1: 6 cards",
   "ref": "eaos/wave-1"
  },
  {
   "at": "2026-10-04T10:00:00+00:00",
   "kind": "merge",
   "title": "eaos/wave-1 merged",
   "ref": "eaos/wave-1"
  },
  {
   "at": "2026-10-08T09:00:00+00:00",
   "kind": "scan",
   "title": "Check after the merge",
   "ref": "e4f5a6b"
  }
 ],
 "progress": [
  {
   "at": "2026-10-01T09:00:00+00:00",
   "event": "baseline",
   "closed": 0,
   "total": 40,
   "percent": 0.0,
   "commit": "a1b2c3d"
  },
  {
   "at": "2026-10-04T10:00:00+00:00",
   "event": "merged",
   "closed": 6,
   "total": 40,
   "percent": 0.15,
   "commit": "c3d4e5f"
  },
  {
   "at": "2026-10-08T09:00:00+00:00",
   "event": "recheck",
   "closed": 8,
   "total": 43,
   "percent": 0.186,
   "commit": "e4f5a6b"
  }
 ],
 "cards": [
  {
   "key": "k-001",
   "id": "TASK-001",
   "title": "Duplicated validation in two forms",
   "state": "done",
   "at": "2026-10-04T10:00:00+00:00",
   "new": false,
   "batch": 1
  },
  {
   "key": "k-007",
   "id": null,
   "title": "Unused helper in utils",
   "state": "resolved",
   "at": "2026-10-08T09:00:00+00:00",
   "new": false,
   "batch": null
  },
  {
   "key": "k-041",
   "id": "TASK-041",
   "title": "A new import cycle between two pages",
   "state": "open",
   "at": null,
   "new": true,
   "batch": null
  }
 ],
 "missing": [],
 "src": {
  "scans": "ledger.json#history[event in baseline, recheck]",
  "progress": "ledger.json#history[].closed / total"
 }
}
